number,value,datetime_start,datetime_complete,duration,params_feature_level,params_lasso_alpha,user_attrs_feature_level,state
0,0.0020687045290005792,2025-12-04 20:18:47.286297,2025-12-04 20:18:47.441756,0 days 00:00:00.155459,simple,0.0006026889128682511,simple,COMPLETE
1,-0.0009470627492772868,2025-12-04 20:18:47.442756,2025-12-04 20:18:47.792827,0 days 00:00:00.350071,simple2,0.3470266988650412,simple2,COMPLETE
2,0.00048550475267838955,2025-12-04 20:18:47.793422,2025-12-04 20:18:47.990552,0 days 00:00:00.197130,simple,0.0008111941985431928,simple,COMPLETE
3,-0.0009470627492772868,2025-12-04 20:18:47.991552,2025-12-04 20:18:48.339749,0 days 00:00:00.348197,simple2,0.0028585493941961923,simple2,COMPLETE
4,-0.0009470627492772868,2025-12-04 20:18:48.340749,2025-12-04 20:18:48.439630,0 days 00:00:00.098881,none,0.019069966103000432,none,COMPLETE
5,-0.019552697685972047,2025-12-04 20:18:48.440630,2025-12-04 20:18:48.540913,0 days 00:00:00.100283,none,0.00017070728830306665,none,COMPLETE
6,-0.0009470627492772868,2025-12-04 20:18:48.542457,2025-12-04 20:18:50.227640,0 days 00:00:01.685183,medium,6.732248920775331,medium,COMPLETE
7,-0.0009470627492772868,2025-12-04 20:18:50.228640,2025-12-04 20:18:50.325810,0 days 00:00:00.097170,none,0.015876781526923997,none,COMPLETE
8,-0.0009470627492772868,2025-12-04 20:18:50.326810,2025-12-04 20:18:51.956363,0 days 00:00:01.629553,medium,0.0019674328025306126,medium,COMPLETE
9,0.00019663266933752274,2025-12-04 20:18:51.956940,2025-12-04 20:18:52.059896,0 days 00:00:00.102956,none,0.0008399864445957502,none,COMPLETE
10,-0.08200957236426343,2025-12-04 20:18:52.060895,2025-12-04 20:18:52.218982,0 days 00:00:00.158087,simple,0.00010714845538373152,simple,COMPLETE
11,0.0020766453273085572,2025-12-04 20:18:52.220681,2025-12-04 20:18:52.358540,0 days 00:00:00.137859,simple,0.0006003917345129201,simple,COMPLETE
12,-0.0009470627492772868,2025-12-04 20:18:52.360144,2025-12-04 20:18:52.496692,0 days 00:00:00.136548,simple,0.2826411346239428,simple,COMPLETE
13,-0.0009470627492772868,2025-12-04 20:18:52.498195,2025-12-04 20:18:52.641209,0 days 00:00:00.143014,simple,0.00540269933557727,simple,COMPLETE
14,0.0033914431415627,2025-12-04 20:18:52.641209,2025-12-04 20:18:52.785347,0 days 00:00:00.144138,simple,0.00042438972468976605,simple,COMPLETE
15,-0.0009470627492772868,2025-12-04 20:18:52.786351,2025-12-04 20:18:52.925529,0 days 00:00:00.139178,simple,0.11986301755344242,simple,COMPLETE
16,0.00198170238226536,2025-12-04 20:18:52.926531,2025-12-04 20:18:53.070023,0 days 00:00:00.143492,simple,0.00029119763260537356,simple,COMPLETE
17,-0.0009470627492772868,2025-12-04 20:18:53.071027,2025-12-04 20:18:53.206694,0 days 00:00:00.135667,simple,0.006085438729156636,simple,COMPLETE
18,-0.0009470627492772868,2025-12-04 20:18:53.207694,2025-12-04 20:18:53.551520,0 days 00:00:00.343826,simple2,0.09086950863125914,simple2,COMPLETE
19,-0.0009470627492772868,2025-12-04 20:18:53.552560,2025-12-04 20:18:55.175158,0 days 00:00:01.622598,medium,2.948231121350258,medium,COMPLETE
20,0.002717412594363533,2025-12-04 20:18:55.176159,2025-12-04 20:18:55.317297,0 days 00:00:00.141138,simple,0.00048758772529269476,simple,COMPLETE
21,0.003013880188646345,2025-12-04 20:18:55.318296,2025-12-04 20:18:55.460920,0 days 00:00:00.142624,simple,0.0004567778860849177,simple,COMPLETE
22,-0.0020636086235891193,2025-12-04 20:18:55.461920,2025-12-04 20:18:55.608342,0 days 00:00:00.146422,simple,0.00024887941230243067,simple,COMPLETE
23,-0.0009470627492772868,2025-12-04 20:18:55.609343,2025-12-04 20:18:55.737815,0 days 00:00:00.128472,simple,0.002091845483235911,simple,COMPLETE
24,-0.09048688500732611,2025-12-04 20:18:55.738820,2025-12-04 20:18:55.886233,0 days 00:00:00.147413,simple,0.00010257560595472769,simple,COMPLETE
25,0.0036951778762706797,2025-12-04 20:18:55.886233,2025-12-04 20:18:56.030455,0 days 00:00:00.144222,simple,0.0003661358949152159,simple,COMPLETE
26,-0.0009470627492772868,2025-12-04 20:18:56.031455,2025-12-04 20:18:56.173598,0 days 00:00:00.142143,simple,0.0016135211589236348,simple,COMPLETE
27,0.0006381474299332149,2025-12-04 20:18:56.174597,2025-12-04 20:18:56.536809,0 days 00:00:00.362212,simple2,0.0003012767187591302,simple2,COMPLETE
28,-0.0009470627492772868,2025-12-04 20:18:56.537810,2025-12-04 20:18:58.203431,0 days 00:00:01.665621,medium,0.01157363580099176,medium,COMPLETE
29,-0.0009470627492772868,2025-12-04 20:18:58.204430,2025-12-04 20:18:58.357607,0 days 00:00:00.153177,simple,0.0010883436156957284,simple,COMPLETE
30,-0.0009470627492772868,2025-12-04 20:18:58.358607,2025-12-04 20:18:58.496505,0 days 00:00:00.137898,simple,0.04525016339582625,simple,COMPLETE
31,0.0032854520152417,2025-12-04 20:18:58.497509,2025-12-04 20:18:58.637419,0 days 00:00:00.139910,simple,0.0004332421863919204,simple,COMPLETE
32,-0.0009470627492772868,2025-12-04 20:18:58.637931,2025-12-04 20:18:58.776454,0 days 00:00:00.138523,simple,0.004471448699655034,simple,COMPLETE
33,0.003511919345704458,2025-12-04 20:18:58.776454,2025-12-04 20:18:58.920960,0 days 00:00:00.144506,simple,0.0004132405848076883,simple,COMPLETE
34,-0.0009470627492772868,2025-12-04 20:18:58.921960,2025-12-04 20:18:59.276025,0 days 00:00:00.354065,simple2,0.0011693180356862583,simple2,COMPLETE
35,-0.003502976610613051,2025-12-04 20:18:59.277026,2025-12-04 20:18:59.425900,0 days 00:00:00.148874,simple,0.00023723208419086251,simple,COMPLETE
36,-0.0009470627492772868,2025-12-04 20:18:59.426899,2025-12-04 20:18:59.571966,0 days 00:00:00.145067,simple,0.003088747699408975,simple,COMPLETE
37,-0.022073633554820282,2025-12-04 20:18:59.572966,2025-12-04 20:18:59.678974,0 days 00:00:00.106008,none,0.00016459374149310616,none,COMPLETE
38,0.002279410167605097,2025-12-04 20:18:59.679972,2025-12-04 20:18:59.827277,0 days 00:00:00.147305,simple,0.0005606643331575721,simple,COMPLETE
39,-0.0009470627492772868,2025-12-04 20:18:59.828278,2025-12-04 20:19:00.193626,0 days 00:00:00.365348,simple2,0.01048858540200734,simple2,COMPLETE
40,-0.0009470627492772868,2025-12-04 20:19:00.194627,2025-12-04 20:19:01.919436,0 days 00:00:01.724809,medium,0.001050909307585896,medium,COMPLETE
41,0.0031307342053037424,2025-12-04 20:19:01.920012,2025-12-04 20:19:02.093676,0 days 00:00:00.173664,simple,0.0004457450526287884,simple,COMPLETE
42,0.0037066132312337428,2025-12-04 20:19:02.094681,2025-12-04 20:19:02.240143,0 days 00:00:00.145462,simple,0.000372606895519756,simple,COMPLETE
43,-0.029246652847163063,2025-12-04 20:19:02.241142,2025-12-04 20:19:02.403442,0 days 00:00:00.162300,simple,0.00015974798093375763,simple,COMPLETE
44,-0.0009470627492772868,2025-12-04 20:19:02.405440,2025-12-04 20:19:02.510100,0 days 00:00:00.104660,none,1.1748124164727554,none,COMPLETE
45,0.0010386026060215843,2025-12-04 20:19:02.511100,2025-12-04 20:19:02.652930,0 days 00:00:00.141830,simple,0.0007506287646750867,simple,COMPLETE
46,-0.0009470627492772868,2025-12-04 20:19:02.654478,2025-12-04 20:19:02.791428,0 days 00:00:00.136950,simple,0.0028457676390281125,simple,COMPLETE
47,-0.09582261289725007,2025-12-04 20:19:02.792431,2025-12-04 20:19:02.962821,0 days 00:00:00.170390,simple,0.00010028889779879691,simple,COMPLETE
48,0.0026979972882100745,2025-12-04 20:19:02.962821,2025-12-04 20:19:03.066134,0 days 00:00:00.103313,none,0.00030963608898612485,none,COMPLETE
49,-0.0009470627492772868,2025-12-04 20:19:03.066134,2025-12-04 20:19:03.202436,0 days 00:00:00.136302,simple,0.001398871851550498,simple,COMPLETE
50,-0.0908790635849522,2025-12-04 20:19:03.203440,2025-12-04 20:19:05.283109,0 days 00:00:02.079669,medium,0.00020060639613182546,medium,COMPLETE
51,0.0036471735824871545,2025-12-04 20:19:05.284109,2025-12-04 20:19:05.440870,0 days 00:00:00.156761,simple,0.0003992783436054957,simple,COMPLETE
52,0.001284570940378112,2025-12-04 20:19:05.441871,2025-12-04 20:19:05.588082,0 days 00:00:00.146211,simple,0.0007207058167322666,simple,COMPLETE
53,0.0027435217738769335,2025-12-04 20:19:05.588082,2025-12-04 20:19:05.725156,0 days 00:00:00.137074,simple,0.00048477889622898675,simple,COMPLETE
54,-0.02650327063367308,2025-12-04 20:19:05.726156,2025-12-04 20:19:05.865671,0 days 00:00:00.139515,simple,0.00016473484803774453,simple,COMPLETE
55,0.003687192723267415,2025-12-04 20:19:05.867174,2025-12-04 20:19:06.017052,0 days 00:00:00.149878,simple,0.00036045966351356434,simple,COMPLETE
56,0.003465986998737199,2025-12-04 20:19:06.018052,2025-12-04 20:19:06.159084,0 days 00:00:00.141032,simple,0.0003313127796812972,simple,COMPLETE
57,0.0005554222819406096,2025-12-04 20:19:06.159084,2025-12-04 20:19:06.296662,0 days 00:00:00.137578,simple,0.0008039637512004813,simple,COMPLETE
58,0.0032760733843051337,2025-12-04 20:19:06.297662,2025-12-04 20:19:06.445320,0 days 00:00:00.147658,simple,0.00031926831284295206,simple,COMPLETE
59,-0.0009470627492772868,2025-12-04 20:19:06.446320,2025-12-04 20:19:06.585430,0 days 00:00:00.139110,simple,0.0021132364190351673,simple,COMPLETE
60,-0.059607314692707115,2025-12-04 20:19:06.586872,2025-12-04 20:19:07.041002,0 days 00:00:00.454130,simple2,0.00013830295225541602,simple2,COMPLETE
61,-0.0031135168030700746,2025-12-04 20:19:07.042003,2025-12-04 20:19:07.182683,0 days 00:00:00.140680,simple,0.00024025162231453234,simple,COMPLETE
62,0.0037162232537971684,2025-12-04 20:19:07.183684,2025-12-04 20:19:07.323010,0 days 00:00:00.139326,simple,0.00038359767508419206,simple,COMPLETE
63,0.0036858403095005134,2025-12-04 20:19:07.324011,2025-12-04 20:19:07.462406,0 days 00:00:00.138395,simple,0.00035987339488417904,simple,COMPLETE
64,0.002189051126375685,2025-12-04 20:19:07.463406,2025-12-04 20:19:07.602053,0 days 00:00:00.138647,simple,0.0005756542288054717,simple,COMPLETE
65,0.00018203713866645396,2025-12-04 20:19:07.603081,2025-12-04 20:19:07.734080,0 days 00:00:00.130999,simple,0.0008413983410681888,simple,COMPLETE
66,-0.0009470627492772868,2025-12-04 20:19:07.734080,2025-12-04 20:19:07.874924,0 days 00:00:00.140844,simple,0.0015368291140434817,simple,COMPLETE
67,-0.0009470627492772868,2025-12-04 20:19:07.875923,2025-12-04 20:19:07.979348,0 days 00:00:00.103425,none,9.712905031234849,none,COMPLETE
68,-0.08370892669413695,2025-12-04 20:19:07.981348,2025-12-04 20:19:10.094708,0 days 00:00:02.113360,medium,0.00020636796973157144,medium,COMPLETE
69,0.0037157472386087167,2025-12-04 20:19:10.095709,2025-12-04 20:19:10.255312,0 days 00:00:00.159603,simple,0.00038462888866232155,simple,COMPLETE
70,-0.000771095357407677,2025-12-04 20:19:10.256313,2025-12-04 20:19:10.444530,0 days 00:00:00.188217,simple,0.0009574512108925298,simple,COMPLETE
71,0.0036708241015409224,2025-12-04 20:19:10.445530,2025-12-04 20:19:10.594709,0 days 00:00:00.149179,simple,0.0003550099989781301,simple,COMPLETE
72,0.0036020702025352977,2025-12-04 20:19:10.596463,2025-12-04 20:19:10.730616,0 days 00:00:00.134153,simple,0.00034401633629097954,simple,COMPLETE
73,-0.05610579660952061,2025-12-04 20:19:10.731613,2025-12-04 20:19:10.883806,0 days 00:00:00.152193,simple,0.00012519159499971142,simple,COMPLETE
74,0.0020273180817297343,2025-12-04 20:19:10.883806,2025-12-04 20:19:11.028412,0 days 00:00:00.144606,simple,0.0006127419746071252,simple,COMPLETE
75,-0.004913319222509001,2025-12-04 20:19:11.029412,2025-12-04 20:19:11.171697,0 days 00:00:00.142285,simple,0.00022671336848762675,simple,COMPLETE
76,-0.0009470627492772868,2025-12-04 20:19:11.172701,2025-12-04 20:19:11.309412,0 days 00:00:00.136711,simple,0.5897039046263632,simple,COMPLETE
77,-0.0009470627492772868,2025-12-04 20:19:11.310412,2025-12-04 20:19:11.673596,0 days 00:00:00.363184,simple2,0.0012482316468637375,simple2,COMPLETE
78,-0.0009470627492772868,2025-12-04 20:19:11.674596,2025-12-04 20:19:11.813800,0 days 00:00:00.139204,simple,0.026813819112335407,simple,COMPLETE
79,0.003699256353126993,2025-12-04 20:19:11.815303,2025-12-04 20:19:11.961020,0 days 00:00:00.145717,simple,0.00039387907018301156,simple,COMPLETE
80,0.0006884692638241541,2025-12-04 20:19:11.962019,2025-12-04 20:19:12.108318,0 days 00:00:00.146299,simple,0.00027538663648221407,simple,COMPLETE
81,0.003561414904776313,2025-12-04 20:19:12.109316,2025-12-04 20:19:12.250525,0 days 00:00:00.141209,simple,0.0004082221442700512,simple,COMPLETE
82,0.0018672959064031474,2025-12-04 20:19:12.250525,2025-12-04 20:19:12.394015,0 days 00:00:00.143490,simple,0.0006393047552854836,simple,COMPLETE
83,0.0037162808470669515,2025-12-04 20:19:12.395016,2025-12-04 20:19:12.537894,0 days 00:00:00.142878,simple,0.0003803991692997585,simple,COMPLETE
84,-0.01473731205657088,2025-12-04 20:19:12.539617,2025-12-04 20:19:12.686565,0 days 00:00:00.146948,simple,0.0001881429479494766,simple,COMPLETE
85,-0.05436830435893569,2025-12-04 20:19:12.688068,2025-12-04 20:19:12.836310,0 days 00:00:00.148242,simple,0.000126693881472077,simple,COMPLETE
86,-0.0009470627492772868,2025-12-04 20:19:12.837813,2025-12-04 20:19:14.505977,0 days 00:00:01.668164,medium,0.10018277271402255,medium,COMPLETE
87,0.0021757929487157637,2025-12-04 20:19:14.507788,2025-12-04 20:19:14.658570,0 days 00:00:00.150782,simple,0.0005783039846722129,simple,COMPLETE
88,-0.0009470627492772868,2025-12-04 20:19:14.659571,2025-12-04 20:19:14.758337,0 days 00:00:00.098766,none,0.0017722174739907169,none,COMPLETE
89,-0.0012896304552052484,2025-12-04 20:19:14.758337,2025-12-04 20:19:14.895876,0 days 00:00:00.137539,simple,0.000255787966313965,simple,COMPLETE
90,0.0036969126875096756,2025-12-04 20:19:14.896876,2025-12-04 20:19:15.042748,0 days 00:00:00.145872,simple,0.0003671363022609463,simple,COMPLETE
91,0.0037122678755305096,2025-12-04 20:19:15.043748,2025-12-04 20:19:15.178542,0 days 00:00:00.134794,simple,0.0003879443351963521,simple,COMPLETE
92,0.002537310676634208,2025-12-04 20:19:15.179127,2025-12-04 20:19:15.310546,0 days 00:00:00.131419,simple,0.0005149120853269522,simple,COMPLETE
93,-0.00044771420109390725,2025-12-04 20:19:15.310546,2025-12-04 20:19:15.452905,0 days 00:00:00.142359,simple,0.000914378975761849,simple,COMPLETE
94,-0.027854330976368285,2025-12-04 20:19:15.452905,2025-12-04 20:19:15.597114,0 days 00:00:00.144209,simple,0.00016225209224068885,simple,COMPLETE
95,0.002136493877773704,2025-12-04 20:19:15.597114,2025-12-04 20:19:15.738839,0 days 00:00:00.141725,simple,0.0002934416316231596,simple,COMPLETE
96,0.0010618608716161197,2025-12-04 20:19:15.739839,2025-12-04 20:19:15.880639,0 days 00:00:00.140800,simple,0.0007478905973594945,simple,COMPLETE
97,0.00292763834963794,2025-12-04 20:19:15.881643,2025-12-04 20:19:16.032181,0 days 00:00:00.150538,simple,0.00046483669120816757,simple,COMPLETE
98,-0.0009470627492772868,2025-12-04 20:19:16.033184,2025-12-04 20:19:16.381380,0 days 00:00:00.348196,simple2,0.05941864093493942,simple2,COMPLETE
99,-0.0009470627492772868,2025-12-04 20:19:16.381380,2025-12-04 20:19:16.520402,0 days 00:00:00.139022,simple,0.001118587365041194,simple,COMPLETE
