number,value,datetime_start,datetime_complete,duration,params_feature_level,params_lgbm_colsample_bytree,params_lgbm_learning_rate,params_lgbm_max_depth,params_lgbm_min_child_samples,params_lgbm_n_estimators,params_lgbm_num_leaves,params_lgbm_reg_alpha,params_lgbm_reg_lambda,params_lgbm_subsample,user_attrs_feature_level,state
0,-0.08864760213640362,2025-12-04 20:20:01.535780,2025-12-04 20:21:12.873244,0 days 00:01:11.337464,advanced,0.8005575058716043,0.00797854234707418,4,15,2891,83,0.10292247147901223,17.052641538983092,0.9330880728874675,advanced,COMPLETE
1,-0.000988146042797548,2025-12-04 20:21:12.874243,2025-12-04 20:21:16.719964,0 days 00:00:03.845721,medium,0.8059264473611898,0.02408207265453543,6,49,730,36,1.4607232426760908,0.6966418981413739,0.645614570099021,medium,COMPLETE
2,-0.0009470627455911244,2025-12-04 20:21:16.720964,2025-12-04 20:21:32.837565,0 days 00:00:16.116601,advanced,0.5325257964926398,0.005746499650110705,8,65,3806,74,4.828160165372797,7.246804518258447,0.5852620618436457,advanced,COMPLETE
3,-0.0009896359832127406,2025-12-04 20:21:32.839068,2025-12-04 20:21:46.606802,0 days 00:00:13.767734,extensive,0.6293899908000085,0.022039920190846215,4,13,2718,65,1.5585553804470549,1.572867419497858,0.954660201039391,extensive,COMPLETE
4,-0.09123974928578904,2025-12-04 20:21:46.607802,2025-12-04 20:21:58.127061,0 days 00:00:11.519259,extensive,0.5442462510259598,0.07297384471483423,12,64,944,103,0.22613644455269033,0.5605248221933016,0.9609371175115584,extensive,COMPLETE
5,-0.0009470627455911244,2025-12-04 20:21:58.128061,2025-12-04 20:22:15.901157,0 days 00:00:17.773096,extensive,0.5372753218398854,0.025411709798607296,5,22,3951,56,3.861223846483287,0.28658321062461245,0.9010984903770198,extensive,COMPLETE
6,-0.0010308158713801714,2025-12-04 20:22:15.902157,2025-12-04 20:22:31.138702,0 days 00:00:15.236545,advanced,0.9315517129377968,0.006241720498669827,10,42,2569,98,1.654490124263246,0.14003921591980473,0.5579345297625649,advanced,COMPLETE
7,-0.0009470627455911244,2025-12-04 20:22:31.139702,2025-12-04 20:22:45.746222,0 days 00:00:14.606520,extensive,0.8803925243084487,0.020574807773456685,11,20,2333,88,3.854835899772805,1.3684800764953189,0.8566223936114975,extensive,COMPLETE
8,-0.0009470627455911244,2025-12-04 20:22:45.747222,2025-12-04 20:22:50.556952,0 days 00:00:04.809730,medium,0.9537832369630466,0.03364798323396056,3,38,1147,28,2.0519146151781484,5.4770389956238,0.7542853455823514,medium,COMPLETE
9,-0.0009470627455911244,2025-12-04 20:22:50.557953,2025-12-04 20:22:58.773642,0 days 00:00:08.215689,extensive,0.9018360384495572,0.05628061807968162,12,67,909,34,4.462794992449889,1.7419780429779415,0.9357302950938589,extensive,COMPLETE
10,-0.0009470627455911244,2025-12-04 20:22:58.774643,2025-12-04 20:23:15.798969,0 days 00:00:17.024326,advanced,0.6806559982209047,0.010561851267458618,8,97,3912,57,3.134418224532838,19.20685509152278,0.5193625999805915,advanced,COMPLETE
11,-0.0009470627455911244,2025-12-04 20:23:15.799971,2025-12-04 20:23:32.179385,0 days 00:00:16.379414,advanced,0.5035244062600627,0.012799550591126398,7,82,3997,122,4.748640763259841,0.10410295138886388,0.7672011503560486,advanced,COMPLETE
12,-0.0009470627455911244,2025-12-04 20:23:32.180385,2025-12-04 20:23:48.405726,0 days 00:00:16.225341,extensive,0.6040480561972924,0.03797786964803238,9,73,3380,52,3.685912145814642,0.3046023103254905,0.6174273340571953,extensive,COMPLETE
13,-0.0009470627455911244,2025-12-04 20:23:48.406726,2025-12-04 20:23:58.328259,0 days 00:00:09.921533,advanced,0.697183403886832,0.014402867012312737,6,31,1773,74,4.9419257325931305,5.169464354451941,0.8342340845456843,advanced,COMPLETE
14,-0.0009470627455911244,2025-12-04 20:23:58.329259,2025-12-04 20:24:06.689340,0 days 00:00:08.360081,medium,0.596609562772596,0.03940781917599237,6,54,3360,48,2.950108960389428,6.268928953136687,0.6669680248018883,medium,COMPLETE
15,-0.0009470627455911244,2025-12-04 20:24:06.690340,2025-12-04 20:24:21.991011,0 days 00:00:15.300671,extensive,0.5004065307940784,0.005683325629142427,8,29,3377,71,4.202685958641559,0.2482753940637073,0.8571298462080281,extensive,COMPLETE
16,-0.0009470627455911244,2025-12-04 20:24:21.992013,2025-12-04 20:24:31.285909,0 days 00:00:09.293896,advanced,0.5621243005829863,0.016732662226901025,5,89,1721,19,3.314132491935567,2.839910012435889,0.6907331226019537,advanced,COMPLETE
17,-0.0009470627455911244,2025-12-04 20:24:31.287910,2025-12-04 20:24:48.747978,0 days 00:00:17.460068,extensive,0.6701096087764186,0.00929915370090235,9,60,3689,120,4.093784190410645,10.566849986197077,0.5749651424412255,extensive,COMPLETE
18,-0.0009470627455911244,2025-12-04 20:24:48.749978,2025-12-04 20:25:03.964304,0 days 00:00:15.214326,advanced,0.7569405787682557,0.030700991447280807,7,79,3109,46,4.991345887242311,0.6509610765979146,0.8020947211594065,advanced,COMPLETE
19,-0.0009470627455911244,2025-12-04 20:25:03.965304,2025-12-04 20:25:06.581700,0 days 00:00:02.616396,medium,0.5693849697152993,0.05303515484438113,3,46,244,62,2.603354693256558,2.8139312229780153,0.7053615290772693,medium,COMPLETE
20,-0.0009470627455911244,2025-12-04 20:25:06.582701,2025-12-04 20:25:17.762283,0 days 00:00:11.179582,extensive,0.6467859223698288,0.09234864242673113,5,27,1985,83,3.673890146609609,0.307390771764457,0.9082631313326377,extensive,COMPLETE
21,-0.0009470627455911244,2025-12-04 20:25:17.763282,2025-12-04 20:25:32.459158,0 days 00:00:14.695876,extensive,0.8947900223275803,0.01748361670399642,11,21,2366,89,3.8583143902056127,1.074119145807017,0.9987349142404867,extensive,COMPLETE
22,-0.0009470627455911244,2025-12-04 20:25:32.460158,2025-12-04 20:25:50.452807,0 days 00:00:17.992649,extensive,0.7311213963056294,0.021398414625347018,10,10,3628,106,4.386908334412812,2.896910840054128,0.8755441254912064,extensive,COMPLETE
23,-0.0009470627455911244,2025-12-04 20:25:50.453809,2025-12-04 20:26:07.396334,0 days 00:00:16.942525,extensive,0.8451222040988928,0.007018565136043654,10,36,3033,74,3.3960557771380335,1.0304207691974399,0.8130439667102342,extensive,COMPLETE
24,-0.0009470627455911244,2025-12-04 20:26:07.397334,2025-12-04 20:26:18.328466,0 days 00:00:10.931132,extensive,0.9747514141515028,0.01122775504749691,11,18,1396,78,4.556078723699699,0.1987562177377211,0.8641404203412878,extensive,COMPLETE
25,-0.0009470627455911244,2025-12-04 20:26:18.329469,2025-12-04 20:26:32.165562,0 days 00:00:13.836093,advanced,0.8472147933184166,0.02666201285570776,9,23,2469,93,2.5670722957611334,9.707531126756619,0.7244278109981884,advanced,COMPLETE
26,-0.0009470627455911244,2025-12-04 20:26:32.166562,2025-12-04 20:26:43.904259,0 days 00:00:11.737697,extensive,0.5335202948502222,0.005190108655299748,5,54,2182,114,3.889423331003157,0.39212043488843423,0.7865900112127263,extensive,COMPLETE
27,-0.0009470627455911244,2025-12-04 20:26:43.905761,2025-12-04 20:27:02.136133,0 days 00:00:18.230372,extensive,0.7244562050406812,0.05070418430934403,8,34,3786,64,4.195251743031221,2.0094991509706666,0.991920906997036,extensive,COMPLETE
28,-0.0009470627455911244,2025-12-04 20:27:02.137635,2025-12-04 20:27:11.254817,0 days 00:00:09.117182,medium,0.7760826093291852,0.01858590595183408,7,71,3486,87,2.99108480948977,4.017245257563085,0.9026351545998642,medium,COMPLETE
29,-0.016742860554672372,2025-12-04 20:27:11.256822,2025-12-04 20:27:32.161202,0 days 00:00:20.904380,advanced,0.8167719303459663,0.008381200611322876,4,15,2951,79,0.6115771361104569,10.518037890423711,0.5026370426030133,advanced,COMPLETE
30,-0.0009470627455911244,2025-12-04 20:27:32.162203,2025-12-04 20:27:50.095922,0 days 00:00:17.933719,advanced,0.9997984743663778,0.030033626124616613,11,25,3099,41,4.6259623444201114,1.0833928696150275,0.8979739020911905,advanced,COMPLETE
31,-0.0009470627455911244,2025-12-04 20:27:50.096924,2025-12-04 20:27:55.169809,0 days 00:00:05.072885,medium,0.9452487940225844,0.036439018581882,3,38,1289,18,2.0814148242152255,7.415173044051418,0.7442850509668516,medium,COMPLETE
32,-0.0009470627455911244,2025-12-04 20:27:55.170813,2025-12-04 20:27:57.938635,0 days 00:00:02.767822,medium,0.901723024533457,0.046793797945719064,4,46,305,26,2.144419436421665,13.02576625290609,0.8315592710401928,medium,COMPLETE
33,-0.0001525930812758721,2025-12-04 20:27:57.940140,2025-12-04 20:28:01.430494,0 days 00:00:03.490354,medium,0.8670192081239578,0.023574513359280767,3,18,602,33,1.015840757214098,4.5269276721252405,0.6054447933591248,medium,COMPLETE
34,-0.0026306490820462436,2025-12-04 20:28:01.431997,2025-12-04 20:28:05.288734,0 days 00:00:03.856737,medium,0.7973860424845611,0.024265047649380006,5,17,583,56,0.7380600909802644,3.965786247453978,0.5960211145055585,medium,COMPLETE
35,-0.0006616276783050212,2025-12-04 20:28:05.290236,2025-12-04 20:28:13.522711,0 days 00:00:08.232475,medium,0.8590788865515172,0.020674907978757297,6,12,2794,42,1.109513288699826,0.47973829432773557,0.6494163889034419,medium,COMPLETE
36,-0.0008617974136217269,2025-12-04 20:28:13.523711,2025-12-04 20:28:21.446179,0 days 00:00:07.922468,medium,0.8575385814820825,0.014758872159370162,6,11,2617,41,1.133396819505404,0.48838721454291384,0.6397243036868452,medium,COMPLETE
37,-0.0009335733855479292,2025-12-04 20:28:21.447178,2025-12-04 20:28:29.598460,0 days 00:00:08.151282,medium,0.8591755485463521,0.014703712609204242,6,11,2766,36,1.1605088867250397,0.4360873351202996,0.637328454258748,medium,COMPLETE
38,-0.0009092070144027057,2025-12-04 20:28:29.599460,2025-12-04 20:28:37.780975,0 days 00:00:08.181515,medium,0.8542165331890511,0.014588461987200603,6,10,2728,35,1.0581069974092152,0.4347779893169907,0.6272410703931331,medium,COMPLETE
39,-0.0009181171353909168,2025-12-04 20:28:37.781975,2025-12-04 20:28:45.914076,0 days 00:00:08.132101,medium,0.9263212592714308,0.014782735696924941,6,10,2600,28,1.1225784117510187,0.5033358677179656,0.5429485320823879,medium,COMPLETE
40,-0.21474564402600818,2025-12-04 20:28:45.915077,2025-12-04 20:29:10.848538,0 days 00:00:24.933461,medium,0.8219247030627865,0.012084775766410094,4,15,2049,40,0.005130792205681578,0.7660504451764325,0.6641280408482695,medium,COMPLETE
41,-0.0009119032264179872,2025-12-04 20:29:10.850533,2025-12-04 20:29:19.152785,0 days 00:00:08.302252,medium,0.9193060517067252,0.014850709230270905,6,10,2636,28,1.1844217759658158,0.47831560355030756,0.541275034362987,medium,COMPLETE
42,-0.000935746952052785,2025-12-04 20:29:19.154292,2025-12-04 20:29:27.590628,0 days 00:00:08.436336,medium,0.8721164234486869,0.019362370142783455,7,14,2864,32,1.3367246771209444,0.7853540240574584,0.6145393458012269,medium,COMPLETE
43,-0.0017299911953013354,2025-12-04 20:29:27.591632,2025-12-04 20:29:36.239232,0 days 00:00:08.647600,medium,0.9209051476351489,0.016699509495402786,5,17,2655,40,0.768830970367482,0.20496703677044634,0.5830758856154384,medium,COMPLETE
44,-0.04280100752011232,2025-12-04 20:29:36.241740,2025-12-04 20:29:49.979547,0 days 00:00:13.737807,medium,0.8369344765339696,0.013301759455780651,6,21,2299,24,0.395933860868251,0.3769458848436938,0.5540849744177707,medium,COMPLETE
45,-0.0009613102460898452,2025-12-04 20:29:49.981551,2025-12-04 20:29:57.902760,0 days 00:00:07.921209,medium,0.7882192750182216,0.02290937505846552,6,25,2787,46,1.759117338536658,0.5559429478305489,0.6345979228707674,medium,COMPLETE
46,-0.0010310395502982257,2025-12-04 20:29:57.902760,2025-12-04 20:30:04.504277,0 days 00:00:06.601517,medium,0.8862393347874178,0.009724138394487887,7,12,1856,32,0.9822185842499841,0.1518676139698163,0.6698630039615306,medium,COMPLETE
47,-0.0009670960098876099,2025-12-04 20:30:04.505786,2025-12-04 20:30:12.637184,0 days 00:00:08.131398,medium,0.9645088516545022,0.027782906526656385,5,30,2491,23,1.4448540531562426,0.8545161436550959,0.6111329614932065,medium,COMPLETE
48,-0.0010341038903164772,2025-12-04 20:30:12.639184,2025-12-04 20:30:18.428757,0 days 00:00:05.789573,medium,0.8727515053362118,0.015980540274110718,6,20,1638,36,1.5991479523046388,1.3123749154911952,0.531590526922724,medium,COMPLETE
49,-0.0529983931856323,2025-12-04 20:30:18.429757,2025-12-04 20:30:31.688417,0 days 00:00:13.258660,medium,0.8261337625770091,0.020133654126676784,4,10,3229,51,0.3983778271925159,0.3448156077994398,0.5645123490618923,medium,COMPLETE
50,-0.0009820905771987427,2025-12-04 20:30:31.689417,2025-12-04 20:30:38.774045,0 days 00:00:07.084628,medium,0.907559635017682,0.01172712759509554,3,15,2206,44,1.766981623714891,0.24373023281357134,0.5936114739181328,medium,COMPLETE
51,-0.000906351468928405,2025-12-04 20:30:38.775548,2025-12-04 20:30:46.928477,0 days 00:00:08.152929,medium,0.9344754884704645,0.014012844132837293,6,11,2528,30,1.0313249292216924,0.5348422903435479,0.536160067553485,medium,COMPLETE
52,-0.000738814095854227,2025-12-04 20:30:46.930477,2025-12-04 20:30:55.146920,0 days 00:00:08.216443,medium,0.8623002221625247,0.01324494670163798,7,19,2695,16,0.9855681974558516,0.49063743112610425,0.5125979674611725,medium,COMPLETE
53,-0.0006107394070643165,2025-12-04 20:30:55.147920,2025-12-04 20:31:03.715009,0 days 00:00:08.567089,medium,0.8588097757339195,0.012880496813908295,8,18,2883,17,0.9565287724302842,0.6493518044523136,0.5052305520070346,medium,COMPLETE
54,-0.001649505401417765,2025-12-04 20:31:03.716008,2025-12-04 20:31:12.119387,0 days 00:00:08.403379,medium,0.9477025299207755,0.010114473676583888,8,24,2403,17,0.7917175812562085,0.6285490749206564,0.5036044829312805,medium,COMPLETE
55,-0.06714591623791104,2025-12-04 20:31:12.120387,2025-12-04 20:31:51.394539,0 days 00:00:39.274152,medium,0.7691833549145657,0.008397728051342028,7,19,2992,21,0.21743749215518737,0.5707857023433408,0.5152840556570066,medium,COMPLETE
56,-0.02073581563789399,2025-12-04 20:31:51.395543,2025-12-04 20:32:02.726995,0 days 00:00:11.331452,medium,0.8640562385229903,0.012987079621741587,8,29,2880,29,0.5232000890303805,0.8935592583715304,0.5258009461929399,medium,COMPLETE
57,-0.0007734525200082665,2025-12-04 20:32:02.727995,2025-12-04 20:32:12.249265,0 days 00:00:09.521270,medium,0.8880546138300925,0.02206828767862947,9,15,3219,17,0.9094109029598483,0.7005997136838334,0.5618447414526158,medium,COMPLETE
58,-0.0008714791343360506,2025-12-04 20:32:12.251265,2025-12-04 20:32:21.170814,0 days 00:00:08.919549,medium,0.8147869997293863,0.022062025721262785,9,27,3209,16,1.2733649839932757,2.1900923835604194,0.5662256963856719,medium,COMPLETE
59,-0.0004662388354261064,2025-12-04 20:32:21.171814,2025-12-04 20:32:30.853713,0 days 00:00:09.681899,medium,0.8804540469054727,0.018974412569447253,9,18,3278,22,0.9066851915706197,1.5651170604250502,0.6884386904358007,medium,COMPLETE
60,-0.0013665045939509717,2025-12-04 20:32:30.856221,2025-12-04 20:32:40.927877,0 days 00:00:10.071656,medium,0.8846467059993419,0.025123075619777016,9,23,3476,21,0.8335962153261463,0.7144834348790668,0.6646424250436387,medium,COMPLETE
61,-0.0007466132437098002,2025-12-04 20:32:40.929877,2025-12-04 20:32:50.349395,0 days 00:00:09.419518,medium,0.842767253457143,0.019592778552809356,10,17,3269,24,0.926320708221654,1.4431532799688502,0.693015604413318,medium,COMPLETE
62,-0.0014034316894930843,2025-12-04 20:32:50.350394,2025-12-04 20:32:59.579425,0 days 00:00:09.229031,medium,0.8388648286093126,0.01845969537235169,10,33,3233,23,0.9380560375534762,1.390195125359223,0.6914789738608442,medium,COMPLETE
63,-0.015896114089575326,2025-12-04 20:32:59.580428,2025-12-04 20:33:11.008957,0 days 00:00:11.428529,medium,0.9031593098857398,0.02892657935921772,9,18,3584,20,0.5698194905715873,1.676188212785611,0.6983679696141478,medium,COMPLETE
64,-0.0009611585236182959,2025-12-04 20:33:11.010960,2025-12-04 20:33:20.588953,0 days 00:00:09.577993,medium,0.8772460759185187,0.03341920569584709,10,21,3335,16,1.430633617954388,2.1069299816062887,0.6544180904689061,medium,COMPLETE
65,-0.06382241099691795,2025-12-04 20:33:20.589953,2025-12-04 20:33:38.942763,0 days 00:00:18.352810,medium,0.8314241586834082,0.020259808303254877,9,27,3116,24,0.2719118492381911,1.2237087212307962,0.7284262661410182,medium,COMPLETE
66,-0.0009470627455911244,2025-12-04 20:33:38.943769,2025-12-04 20:33:49.083908,0 days 00:00:10.140139,medium,0.8069747522014322,0.01759775343109886,8,16,3854,26,1.915091608772395,3.417316728658829,0.7153258843154845,medium,COMPLETE
67,-0.0004344732559931064,2025-12-04 20:33:49.084908,2025-12-04 20:33:59.132157,0 days 00:00:10.047249,medium,0.89167515669786,0.02317620840422141,10,14,3436,21,0.8730068804164528,2.5117142788677653,0.5561754281716309,medium,COMPLETE
68,-0.008835987394547828,2025-12-04 20:33:59.133158,2025-12-04 20:34:11.427721,0 days 00:00:12.294563,medium,0.9123371872750665,0.016086182931251615,12,20,3765,33,0.6247507286656583,2.327031299556712,0.6795019553928423,medium,COMPLETE
69,-0.0008856376067927219,2025-12-04 20:34:11.429728,2025-12-04 20:34:20.690661,0 days 00:00:09.260933,medium,0.7889942418414002,0.0249948183439484,11,60,3488,21,1.3160675997503197,5.161897178070827,0.602773942962961,medium,COMPLETE
70,-0.029531175759195765,2025-12-04 20:34:20.691663,2025-12-04 20:34:41.180985,0 days 00:00:20.489322,advanced,0.8466089602446911,0.010960742321512612,10,13,1032,26,0.45118670780991976,1.5963562522801023,0.5106645229743423,advanced,COMPLETE
71,-0.0006976406816378381,2025-12-04 20:34:41.181985,2025-12-04 20:34:50.828439,0 days 00:00:09.646454,medium,0.8809452082661045,0.02253121411966398,9,17,3255,16,0.9404369658221379,0.948131037649232,0.5799670171123018,medium,COMPLETE
72,-0.002908443063756705,2025-12-04 20:34:50.829442,2025-12-04 20:34:59.931671,0 days 00:00:09.102229,medium,0.8693435896835502,0.026634296857601325,8,18,3069,20,0.759869722740298,0.9999682578376096,0.5511461030109455,medium,COMPLETE
73,-0.00741426255278325,2025-12-04 20:34:59.933670,2025-12-04 20:35:10.196477,0 days 00:00:10.262807,medium,0.8937436865096934,0.03240369226837855,10,23,3335,37,0.6540678715958539,2.746893940235742,0.5823438095165521,medium,COMPLETE
74,-0.0009470627455911244,2025-12-04 20:35:10.197482,2025-12-04 20:35:20.234913,0 days 00:00:10.037431,medium,0.8576877483923443,0.022551199618761227,9,26,3575,25,2.344033768436952,1.7966666789740244,0.6467003052897157,medium,COMPLETE
75,-0.0009793354147632864,2025-12-04 20:35:20.235913,2025-12-04 20:35:29.293832,0 days 00:00:09.057919,medium,0.9411761942632707,0.041296445078475706,10,32,2911,31,1.4910383365565825,1.253815975844514,0.6259237602484439,medium,COMPLETE
76,-0.0008594995430461309,2025-12-04 20:35:29.294834,2025-12-04 20:35:38.839821,0 days 00:00:09.544987,medium,0.8449530945081238,0.018358503572500684,11,13,3413,16,1.2396253211230712,4.340095656114346,0.7600149681025538,medium,COMPLETE
77,-0.0008315819338196769,2025-12-04 20:35:38.841822,2025-12-04 20:35:42.516370,0 days 00:00:03.674548,medium,0.8074620138898232,0.06584959929238912,8,91,754,20,0.9665339115900863,3.341086485962703,0.5746440712385902,medium,COMPLETE
78,-0.0010940184738034524,2025-12-04 20:35:42.517371,2025-12-04 20:35:51.053972,0 days 00:00:08.536601,medium,0.8953742237759861,0.020414372978407893,7,40,2806,28,0.8787881634138107,0.8890969504636166,0.5187368941673478,medium,COMPLETE
79,-0.05743605018246023,2025-12-04 20:35:51.055972,2025-12-04 20:36:36.577740,0 days 00:00:45.521768,medium,0.9814485960096313,0.007212628542603857,9,17,3725,127,0.24827187241779225,1.1110456385380147,0.7399754404752137,medium,COMPLETE
80,-0.0010407694002321961,2025-12-04 20:36:36.578740,2025-12-04 20:36:54.063770,0 days 00:00:17.485030,advanced,0.9145983833139649,0.023761525639799972,10,13,3170,38,1.6880052717193132,2.5179385847849156,0.6102085136834497,advanced,COMPLETE
81,-0.0009065110821629604,2025-12-04 20:36:54.064771,2025-12-04 20:37:03.741608,0 days 00:00:09.676837,medium,0.8884397953089582,0.021050969646244595,9,16,3301,18,1.0751235492077629,0.6111186142704008,0.5582343168362445,medium,COMPLETE
82,-0.0006607556525153324,2025-12-04 20:37:03.742609,2025-12-04 20:37:12.653868,0 days 00:00:08.911259,medium,0.879542935362107,0.02724686575525827,8,22,3017,23,0.894021669674923,0.6915296827061245,0.5467340734388227,medium,COMPLETE
83,-0.0010113364778866856,2025-12-04 20:37:12.655868,2025-12-04 20:37:21.399928,0 days 00:00:08.744060,medium,0.8664485161545938,0.030433713941169456,8,22,2996,68,1.3757585270046002,1.4667986526454289,0.5260618662686315,medium,COMPLETE
84,-0.009362142519962665,2025-12-04 20:37:21.400929,2025-12-04 20:37:30.655037,0 days 00:00:09.254108,medium,0.8803562966326653,0.03556844399542599,7,19,3020,22,0.6658498717612484,1.8318839276733818,0.5933987989142127,medium,COMPLETE
85,-0.0009239825475254962,2025-12-04 20:37:30.656035,2025-12-04 20:37:40.574523,0 days 00:00:09.918488,medium,0.8311942001465996,0.027613662869914256,8,14,3641,27,1.1790870009688366,0.9363854542219162,0.5505587292288734,medium,COMPLETE
86,-0.019901915188319148,2025-12-04 20:37:40.575579,2025-12-04 20:37:51.028413,0 days 00:00:10.452834,medium,0.8523825493950831,0.015883201744574374,8,21,2707,34,0.5178091458484783,0.4266098742242473,0.5752104917551337,medium,COMPLETE
87,-0.0013812705027825463,2025-12-04 20:37:51.029417,2025-12-04 20:38:01.507405,0 days 00:00:10.477988,medium,0.9280763529198213,0.017559442669626973,10,25,3447,31,0.8778321221961464,1.142366273031529,0.5395204571179355,medium,COMPLETE
88,-0.0009701313455264445,2025-12-04 20:38:01.509912,2025-12-04 20:38:17.435572,0 days 00:00:15.925660,extensive,0.7311954522169174,0.019293534873110352,7,19,3114,25,1.0152460968977068,0.32437565346993874,0.5006104803780816,extensive,COMPLETE
89,-0.001043085366519536,2025-12-04 20:38:17.436572,2025-12-04 20:38:23.016550,0 days 00:00:05.579978,medium,0.9038388517616434,0.012247600269923505,11,28,1536,19,1.5458465419442444,0.7724987629941021,0.6849465625225003,medium,COMPLETE
