number,value,datetime_start,datetime_complete,duration,params_feature_level,params_ridge_alpha,user_attrs_feature_level,state
0,-9.956233512046113,2025-12-04 20:18:18.840432,2025-12-04 20:18:18.983997,0 days 00:00:00.143565,simple,0.0012363188277052211,simple,COMPLETE
1,-1.977069213460143,2025-12-04 20:18:18.984995,2025-12-04 20:18:19.336266,0 days 00:00:00.351271,simple2,9.047071957568372,simple2,COMPLETE
2,-9.952888014137907,2025-12-04 20:18:19.336266,2025-12-04 20:18:19.472601,0 days 00:00:00.136335,simple,0.0018740223688836334,simple,COMPLETE
3,-11.16810046290596,2025-12-04 20:18:19.472601,2025-12-04 20:18:19.817167,0 days 00:00:00.344566,simple2,0.010929592787219389,simple2,COMPLETE
4,-6.820201450502265,2025-12-04 20:18:19.818171,2025-12-04 20:18:19.914785,0 days 00:00:00.096614,none,0.15577217702693022,none,COMPLETE
5,-7.639736703255644,2025-12-04 20:18:19.915288,2025-12-04 20:18:20.016077,0 days 00:00:00.100789,none,0.00021142332035497166,none,COMPLETE
6,-8820.030754543464,2025-12-04 20:18:20.017075,2025-12-04 20:18:21.711447,0 days 00:00:01.694372,medium,574.6775499181848,medium,COMPLETE
7,-6.987566116665795,2025-12-04 20:18:21.713450,2025-12-04 20:18:21.814784,0 days 00:00:00.101334,none,0.12052231254145616,none,COMPLETE
8,-5368535.322113884,2025-12-04 20:18:21.815789,2025-12-04 20:18:23.558175,0 days 00:00:01.742386,medium,0.006478282331897323,medium,COMPLETE
9,-7.629177288466313,2025-12-04 20:18:23.559175,2025-12-04 20:18:23.659669,0 days 00:00:00.100494,none,0.001967801053211494,none,COMPLETE
10,-0.6780189046649938,2025-12-04 20:18:23.660669,2025-12-04 20:18:24.019309,0 days 00:00:00.358640,simple2,46.58203647475288,simple2,COMPLETE
11,-0.6274597915138633,2025-12-04 20:18:24.020254,2025-12-04 20:18:24.371528,0 days 00:00:00.351274,simple2,53.01136230521693,simple2,COMPLETE
12,-0.7299909875587142,2025-12-04 20:18:24.372531,2025-12-04 20:18:24.724815,0 days 00:00:00.352284,simple2,41.24763734015361,simple2,COMPLETE
13,-2.5501391577519184,2025-12-04 20:18:24.725814,2025-12-04 20:18:25.086267,0 days 00:00:00.360453,simple2,6.14906188646791,simple2,COMPLETE
14,-0.10426996841964124,2025-12-04 20:18:25.087772,2025-12-04 20:18:25.439967,0 days 00:00:00.352195,simple2,931.846469060939,simple2,COMPLETE
15,-0.14010714801759874,2025-12-04 20:18:25.440966,2025-12-04 20:18:25.794621,0 days 00:00:00.353655,simple2,611.6939556615655,simple2,COMPLETE
16,-0.10415420608368635,2025-12-04 20:18:25.795620,2025-12-04 20:18:26.147433,0 days 00:00:00.351813,simple2,933.2779078116369,simple2,COMPLETE
17,-5.844346884253375,2025-12-04 20:18:26.148432,2025-12-04 20:18:26.501832,0 days 00:00:00.353400,simple2,1.3665221215850774,simple2,COMPLETE
18,-7707.881229911681,2025-12-04 20:18:26.502834,2025-12-04 20:18:28.267961,0 days 00:00:01.765127,medium,984.1249185098026,medium,COMPLETE
19,-0.25177939211514927,2025-12-04 20:18:28.268960,2025-12-04 20:18:28.427499,0 days 00:00:00.158539,simple,171.4795473501127,simple,COMPLETE
20,-5.097361204853695,2025-12-04 20:18:28.428500,2025-12-04 20:18:28.781288,0 days 00:00:00.352788,simple2,1.8439397104317108,simple2,COMPLETE
21,-0.2799692695627127,2025-12-04 20:18:28.781994,2025-12-04 20:18:29.135979,0 days 00:00:00.353985,simple2,208.1063179831531,simple2,COMPLETE
22,-0.26737708192272763,2025-12-04 20:18:29.135979,2025-12-04 20:18:29.489172,0 days 00:00:00.353193,simple2,224.3931158962973,simple2,COMPLETE
23,-0.10378936952971311,2025-12-04 20:18:29.490172,2025-12-04 20:18:29.834288,0 days 00:00:00.344116,simple2,937.8118632537149,simple2,COMPLETE
24,-1.3585821247993808,2025-12-04 20:18:29.835288,2025-12-04 20:18:30.190216,0 days 00:00:00.354928,simple2,15.774246910248635,simple2,COMPLETE
25,-0.36308707432013265,2025-12-04 20:18:30.191914,2025-12-04 20:18:30.545189,0 days 00:00:00.353275,simple2,134.8146220396075,simple2,COMPLETE
26,-0.1032096257700487,2025-12-04 20:18:30.546189,2025-12-04 20:18:30.890554,0 days 00:00:00.344365,simple2,945.0879581858463,simple2,COMPLETE
27,-4.756142518953478,2025-12-04 20:18:30.891554,2025-12-04 20:18:31.035896,0 days 00:00:00.144342,simple,2.115932272663268,simple,COMPLETE
28,-42670.12668897059,2025-12-04 20:18:31.035896,2025-12-04 20:18:32.743536,0 days 00:00:01.707640,medium,23.69747203254619,medium,COMPLETE
29,-0.28143977005182524,2025-12-04 20:18:32.744536,2025-12-04 20:18:32.891332,0 days 00:00:00.146796,simple,143.64730651470416,simple,COMPLETE
30,-8.09236181546801,2025-12-04 20:18:32.892332,2025-12-04 20:18:33.250409,0 days 00:00:00.358077,simple2,0.5222376908674639,simple2,COMPLETE
31,-0.1032146630225997,2025-12-04 20:18:33.251409,2025-12-04 20:18:33.616978,0 days 00:00:00.365569,simple2,945.0243570419292,simple2,COMPLETE
32,-0.1845553514808019,2025-12-04 20:18:33.618553,2025-12-04 20:18:33.969748,0 days 00:00:00.351195,simple2,404.1454772299541,simple2,COMPLETE
33,-0.47833175642123343,2025-12-04 20:18:33.970751,2025-12-04 20:18:34.317831,0 days 00:00:00.347080,simple2,84.1470316905168,simple2,COMPLETE
34,-0.19975119287177523,2025-12-04 20:18:34.318830,2025-12-04 20:18:34.672687,0 days 00:00:00.353857,simple2,357.4755954180819,simple2,COMPLETE
35,-1.3654628084557645,2025-12-04 20:18:34.673025,2025-12-04 20:18:35.028826,0 days 00:00:00.355801,simple2,15.656400174388668,simple2,COMPLETE
36,-2.56862724621333,2025-12-04 20:18:35.029825,2025-12-04 20:18:35.385859,0 days 00:00:00.356034,simple2,6.080634632619074,simple2,COMPLETE
37,-0.1436138911246283,2025-12-04 20:18:35.386859,2025-12-04 20:18:35.482238,0 days 00:00:00.095379,none,367.55402770231564,none,COMPLETE
38,-0.08289947205731078,2025-12-04 20:18:35.482238,2025-12-04 20:18:35.622732,0 days 00:00:00.140494,simple,937.639901277158,simple,COMPLETE
39,-0.4075826554855524,2025-12-04 20:18:35.623732,2025-12-04 20:18:35.758159,0 days 00:00:00.134427,simple,80.40062529192292,simple,COMPLETE
40,-9.693922542005105,2025-12-04 20:18:35.759160,2025-12-04 20:18:35.894231,0 days 00:00:00.135071,simple,0.05264830133512071,simple,COMPLETE
41,-0.08456317939303244,2025-12-04 20:18:35.895231,2025-12-04 20:18:36.040636,0 days 00:00:00.145405,simple,911.5755322690196,simple,COMPLETE
42,-0.1561014134654505,2025-12-04 20:18:36.040636,2025-12-04 20:18:36.175329,0 days 00:00:00.134693,simple,365.0270296501639,simple,COMPLETE
43,-0.1452819650089959,2025-12-04 20:18:36.176328,2025-12-04 20:18:36.313431,0 days 00:00:00.137103,simple,407.98978867806755,simple,COMPLETE
44,-0.2986683894212438,2025-12-04 20:18:36.313431,2025-12-04 20:18:36.443553,0 days 00:00:00.130122,simple,130.7313594953877,simple,COMPLETE
45,-0.07992949782246961,2025-12-04 20:18:36.444553,2025-12-04 20:18:36.585994,0 days 00:00:00.141441,simple,987.1901912627054,simple,COMPLETE
46,-9.961179983471117,2025-12-04 20:18:36.585994,2025-12-04 20:18:36.722109,0 days 00:00:00.136115,simple,0.0002942826945522907,simple,COMPLETE
47,-0.7052187940617234,2025-12-04 20:18:36.723109,2025-12-04 20:18:36.855657,0 days 00:00:00.132548,simple,35.764087397813505,simple,COMPLETE
48,-9.818969484612277,2025-12-04 20:18:36.857217,2025-12-04 20:18:36.995530,0 days 00:00:00.138313,simple,0.027779714068110983,simple,COMPLETE
49,-0.3398697513635805,2025-12-04 20:18:36.996531,2025-12-04 20:18:37.091474,0 days 00:00:00.094943,none,90.55719883641852,none,COMPLETE
50,-0.11718479450044161,2025-12-04 20:18:37.091474,2025-12-04 20:18:37.230298,0 days 00:00:00.138824,simple,565.8756694628972,simple,COMPLETE
51,-8191.2637264255345,2025-12-04 20:18:37.231299,2025-12-04 20:18:38.978074,0 days 00:00:01.746775,medium,763.0259982416321,medium,COMPLETE
52,-0.18837101075237958,2025-12-04 20:18:38.979074,2025-12-04 20:18:39.122442,0 days 00:00:00.143368,simple,271.86554367393205,simple,COMPLETE
53,-0.08466505163095601,2025-12-04 20:18:39.123443,2025-12-04 20:18:39.252826,0 days 00:00:00.129383,simple,910.0167824719281,simple,COMPLETE
54,-0.116148455737395,2025-12-04 20:18:39.253827,2025-12-04 20:18:39.391842,0 days 00:00:00.138015,simple,573.4595101955599,simple,COMPLETE
55,-0.20386367549231096,2025-12-04 20:18:39.392843,2025-12-04 20:18:39.531212,0 days 00:00:00.138369,simple,239.89545892914535,simple,COMPLETE
56,-0.4796567724636563,2025-12-04 20:18:39.531212,2025-12-04 20:18:39.670728,0 days 00:00:00.139516,simple,62.768460125717496,simple,COMPLETE
57,-0.08434974500254404,2025-12-04 20:18:39.671728,2025-12-04 20:18:39.808591,0 days 00:00:00.136863,simple,914.8549796889854,simple,COMPLETE
58,-0.1177860970094824,2025-12-04 20:18:39.808591,2025-12-04 20:18:39.942367,0 days 00:00:00.133776,simple,561.5472525575415,simple,COMPLETE
59,-9.937064537937768,2025-12-04 20:18:39.943367,2025-12-04 20:18:40.085194,0 days 00:00:00.141827,simple,0.004896425116889243,simple,COMPLETE
60,-0.25518991352214254,2025-12-04 20:18:40.086199,2025-12-04 20:18:40.227760,0 days 00:00:00.141561,simple,167.84591147417913,simple,COMPLETE
61,-0.07407802930306051,2025-12-04 20:18:40.228760,2025-12-04 20:18:40.323381,0 days 00:00:00.094621,none,948.8885185198363,none,COMPLETE
62,-0.11028820370998837,2025-12-04 20:18:40.324381,2025-12-04 20:18:40.418276,0 days 00:00:00.093895,none,541.8156129561936,none,COMPLETE
63,-0.07316277237540499,2025-12-04 20:18:40.419276,2025-12-04 20:18:40.517233,0 days 00:00:00.097957,none,965.1763723499888,none,COMPLETE
64,-0.19750214884697495,2025-12-04 20:18:40.518232,2025-12-04 20:18:40.609751,0 days 00:00:00.091519,none,225.13574429555138,none,COMPLETE
65,-0.161523516522133,2025-12-04 20:18:40.610751,2025-12-04 20:18:40.711173,0 days 00:00:00.100422,none,307.73640574663574,none,COMPLETE
66,-0.2957827309648659,2025-12-04 20:18:40.712172,2025-12-04 20:18:40.808265,0 days 00:00:00.096093,none,115.45618999433691,none,COMPLETE
67,-0.07344874860562205,2025-12-04 20:18:40.809548,2025-12-04 20:18:40.900618,0 days 00:00:00.091070,none,960.0388308300312,none,COMPLETE
68,-0.11043673517154821,2025-12-04 20:18:40.901618,2025-12-04 20:18:41.001724,0 days 00:00:00.100106,none,540.7635062252004,none,COMPLETE
69,-0.20735791704952714,2025-12-04 20:18:41.002232,2025-12-04 20:18:41.100870,0 days 00:00:00.098638,none,208.34125099816052,none,COMPLETE
70,-0.10631314153726128,2025-12-04 20:18:41.101868,2025-12-04 20:18:41.190161,0 days 00:00:00.088293,none,571.2422679583769,none,COMPLETE
71,-0.07262465059128043,2025-12-04 20:18:41.191166,2025-12-04 20:18:41.287648,0 days 00:00:00.096482,none,974.9651982438345,none,COMPLETE
72,-0.15295511147711327,2025-12-04 20:18:41.287648,2025-12-04 20:18:41.385585,0 days 00:00:00.097937,none,334.30218840676037,none,COMPLETE
73,-0.07134510660022235,2025-12-04 20:18:41.386587,2025-12-04 20:18:41.482161,0 days 00:00:00.095574,none,998.8973245084276,none,COMPLETE
74,-0.12508651188601072,2025-12-04 20:18:41.483482,2025-12-04 20:18:41.579917,0 days 00:00:00.096435,none,451.06817789185936,none,COMPLETE
75,-0.23290083923079674,2025-12-04 20:18:41.580917,2025-12-04 20:18:41.677635,0 days 00:00:00.096718,none,172.61006560526172,none,COMPLETE
76,-0.07254781855314718,2025-12-04 20:18:41.678634,2025-12-04 20:18:41.775387,0 days 00:00:00.096753,none,976.3759376563579,none,COMPLETE
77,-0.4641725373413,2025-12-04 20:18:41.775387,2025-12-04 20:18:41.870779,0 days 00:00:00.095392,none,51.59755649057204,none,COMPLETE
78,-6.411053707837226,2025-12-04 20:18:41.871779,2025-12-04 20:18:41.968991,0 days 00:00:00.097212,none,0.2510164281018381,none,COMPLETE
79,-0.1703951177631103,2025-12-04 20:18:41.969991,2025-12-04 20:18:42.068019,0 days 00:00:00.098028,none,283.51547340959684,none,COMPLETE
80,-0.0961345878865066,2025-12-04 20:18:42.068019,2025-12-04 20:18:42.167263,0 days 00:00:00.099244,none,659.5601640883255,none,COMPLETE
81,-0.07350576400157127,2025-12-04 20:18:42.168264,2025-12-04 20:18:42.267483,0 days 00:00:00.099219,none,959.0198466127536,none,COMPLETE
82,-0.1264260210681066,2025-12-04 20:18:42.268483,2025-12-04 20:18:42.364933,0 days 00:00:00.096450,none,444.0647687295631,none,COMPLETE
83,-0.08881305389265474,2025-12-04 20:18:42.365938,2025-12-04 20:18:42.460638,0 days 00:00:00.094700,none,737.6419177151132,none,COMPLETE
84,-0.3087840060039171,2025-12-04 20:18:42.461639,2025-12-04 20:18:42.560475,0 days 00:00:00.098836,none,107.16407358548695,none,COMPLETE
85,-0.16098144300179965,2025-12-04 20:18:42.561475,2025-12-04 20:18:42.653355,0 days 00:00:00.091880,none,309.3187314514072,none,COMPLETE
86,-7722.18426092996,2025-12-04 20:18:42.654353,2025-12-04 20:18:44.365949,0 days 00:00:01.711596,medium,976.4255933474764,medium,COMPLETE
87,-0.12116904503152177,2025-12-04 20:18:44.366947,2025-12-04 20:18:44.467589,0 days 00:00:00.100642,none,472.5903283595514,none,COMPLETE
88,-7.640312973980826,2025-12-04 20:18:44.468103,2025-12-04 20:18:44.565017,0 days 00:00:00.096914,none,0.00011573532513510408,none,COMPLETE
89,-0.0973392180357971,2025-12-04 20:18:44.565017,2025-12-04 20:18:44.662843,0 days 00:00:00.097826,none,647.9947537038196,none,COMPLETE
90,-0.22616346782343455,2025-12-04 20:18:44.663841,2025-12-04 20:18:44.757487,0 days 00:00:00.093646,none,181.09403673541013,none,COMPLETE
91,-0.07373815070062761,2025-12-04 20:18:44.758488,2025-12-04 20:18:44.856554,0 days 00:00:00.098066,none,954.8846698568731,none,COMPLETE
92,-0.08797860920151941,2025-12-04 20:18:44.857135,2025-12-04 20:18:44.956169,0 days 00:00:00.099034,none,747.4863939325415,none,COMPLETE
93,-0.14006769068518463,2025-12-04 20:18:44.957169,2025-12-04 20:18:45.055901,0 days 00:00:00.098732,none,381.54872344363866,none,COMPLETE
94,-0.07458318944622262,2025-12-04 20:18:45.056902,2025-12-04 20:18:45.153027,0 days 00:00:00.096125,none,940.0884321739804,none,COMPLETE
95,-0.09221948739192405,2025-12-04 20:18:45.154027,2025-12-04 20:18:45.246714,0 days 00:00:00.092687,none,699.5509922925578,none,COMPLETE
96,-0.12625255145655237,2025-12-04 20:18:45.248219,2025-12-04 20:18:45.342888,0 days 00:00:00.094669,none,444.9619596183535,none,COMPLETE
97,-0.1840130562631217,2025-12-04 20:18:45.344440,2025-12-04 20:18:45.440023,0 days 00:00:00.095583,none,251.63892168453336,none,COMPLETE
98,-4.9016185202517315,2025-12-04 20:18:45.441023,2025-12-04 20:18:45.538102,0 days 00:00:00.097079,none,0.7647012493484104,none,COMPLETE
99,-7691.003339834259,2025-12-04 20:18:45.539108,2025-12-04 20:18:47.285293,0 days 00:00:01.746185,medium,993.3059310276024,medium,COMPLETE
