number,value,datetime_start,datetime_complete,duration,params_feature_level,params_xgb_colsample_bytree,params_xgb_learning_rate,params_xgb_max_depth,params_xgb_min_child_weight,params_xgb_n_estimators,params_xgb_reg_alpha,params_xgb_reg_lambda,params_xgb_subsample,user_attrs_feature_level,state
90,-0.000709708452143761,2025-12-04 22:19:26.726497,2025-12-04 22:19:33.222150,0 days 00:00:06.495653,medium,0.338875230550461,0.0024693158147834566,10,14,205,1.1888894800222864,3.830621493979777,0.7960979562516878,medium,COMPLETE
91,0.0002494109043444566,2025-12-04 22:19:33.223153,2025-12-04 22:20:00.738044,0 days 00:00:27.514891,medium,0.36333599745847817,0.0016612064233971948,10,13,673,0.5963864522184159,2.8926551071543405,0.6925884390330057,medium,COMPLETE
92,0.0007192782871967193,2025-12-04 22:20:00.739044,2025-12-04 22:20:19.244752,0 days 00:00:18.505708,medium,0.31454923529156387,0.001670172326574308,10,14,397,0.4570842824345497,2.0083513854990738,0.7017913342348783,medium,COMPLETE
93,0.00030695176735436497,2025-12-04 22:20:19.245753,2025-12-04 22:20:42.782689,0 days 00:00:23.536936,medium,0.315952598551717,0.0017163991178114383,10,13,375,0.28226930679168555,2.0197691197695886,0.683523511302162,medium,COMPLETE
94,2.1553135495048597e-05,2025-12-04 22:20:42.783689,2025-12-04 22:21:11.363026,0 days 00:00:28.579337,medium,0.3161580051006695,0.001808636705040762,10,15,416,0.09250833540279096,2.1041110223536283,0.7003987785494891,medium,COMPLETE
95,0.00021447575869896576,2025-12-04 22:21:11.364027,2025-12-04 22:21:55.277860,0 days 00:00:43.913833,medium,0.3990219346117792,0.0016622996323124182,10,13,665,0.2972420199536311,1.964511790614772,0.7116624691380088,medium,COMPLETE
96,-0.005661839882420787,2025-12-04 22:21:55.278860,2025-12-04 22:24:10.615924,0 days 00:02:15.337064,medium,0.3990819811511279,0.0014501840373964863,10,13,2284,0.3035261458134074,1.5914702850402198,0.6756774148539874,medium,COMPLETE
97,-0.0009470627425554786,2025-12-04 22:24:10.617924,2025-12-04 22:24:16.920303,0 days 00:00:06.302379,medium,0.33530708712114643,0.0017384192988331832,9,14,577,4.374611934062081,1.9478989452036959,0.6503447789783584,medium,COMPLETE
98,-0.0011849819700159674,2025-12-04 22:24:16.921305,2025-12-04 22:25:00.989394,0 days 00:00:44.068089,medium,0.4182665183750443,0.002416957115001253,10,14,810,0.4115091364353787,0.9486389072043725,0.7133724315049771,medium,COMPLETE
99,-0.0007356692394800598,2025-12-04 22:25:00.990898,2025-12-04 22:25:43.265281,0 days 00:00:42.274383,medium,0.44623950542052493,0.0019205623171432889,9,13,642,0.23006783487022625,2.95414877359943,0.588944029654181,medium,COMPLETE
