number,value,datetime_start,datetime_complete,duration,params_feature_level,params_xgb_colsample_bytree,params_xgb_learning_rate,params_xgb_max_depth,params_xgb_min_child_weight,params_xgb_n_estimators,params_xgb_reg_alpha,params_xgb_reg_lambda,params_xgb_subsample,user_attrs_feature_level,state
0,-0.12618051399225635,2025-12-04 20:40:05.078858,2025-12-04 20:42:10.599606,0 days 00:02:05.520748,advanced,0.33485016730091965,0.029621516588303493,7,4,2484,0.10292247147901223,4.258888210290081,0.3935967122017216,advanced,COMPLETE
1,-0.00477211124715371,2025-12-04 20:42:10.600608,2025-12-04 20:42:33.176470,0 days 00:00:22.575862,medium,0.6148538589793427,0.005418282319533243,4,4,1306,0.6974693032602092,2.5579488960947363,0.4825453457757226,medium,COMPLETE
2,-0.0063459942315794065,2025-12-04 20:42:33.178473,2025-12-04 20:47:58.170411,0 days 00:05:24.991938,extensive,0.6554487413172255,0.0011992724522955163,9,4,2509,0.3252579649263976,0.24682044079890128,0.608540663048167,extensive,COMPLETE
3,-0.0009470627425554786,2025-12-04 20:47:58.172411,2025-12-04 20:48:28.289039,0 days 00:00:30.116628,advanced,0.5640914962437609,0.001611904472760919,5,2,2082,4.546602010393911,0.11998556988857204,0.7105398159072942,advanced,COMPLETE
4,-0.0009470627425554786,2025-12-04 20:48:28.290041,2025-12-04 20:49:20.789599,0 days 00:00:52.499558,advanced,0.8817507766587351,0.020745667656752512,7,11,3771,2.9894998940554256,11.455777613940603,0.4109126733153162,advanced,COMPLETE
5,-0.0009470627425554786,2025-12-04 20:49:20.790603,2025-12-04 20:49:37.584570,0 days 00:00:16.793967,medium,0.4628094190643376,0.02558586885593425,3,7,1556,2.7134804157912424,0.4430357105538921,0.5332063738136892,medium,COMPLETE
6,-0.0009470627425554786,2025-12-04 20:49:37.585570,2025-12-04 20:50:27.781364,0 days 00:00:50.195794,advanced,0.30331327027416144,0.024290950368254956,10,16,2886,3.8563517334297286,4.758470274910409,0.4192294089205034,advanced,COMPLETE
7,-0.0009470627425554786,2025-12-04 20:50:27.783365,2025-12-04 20:50:57.724002,0 days 00:00:29.940637,advanced,0.3381350101716142,0.0033755895712060846,9,13,1436,3.1877873567760657,4.7735964446695265,0.4985388149115895,advanced,COMPLETE
8,-0.07543935160913806,2025-12-04 20:50:57.726003,2025-12-04 20:55:59.094190,0 days 00:05:01.368187,medium,0.7625803079727367,0.0069015065817919245,8,16,2186,0.12709563372047594,0.9633513440110397,0.6367663185416979,medium,COMPLETE
9,-0.03954765145985221,2025-12-04 20:55:59.095694,2025-12-04 21:00:44.006738,0 days 00:04:44.911044,extensive,0.449575337489325,0.004979987773685085,5,11,3071,0.38489954914396496,0.33610226697378737,0.844539884355656,extensive,COMPLETE
10,-0.0009470627425554786,2025-12-04 21:00:44.008743,2025-12-04 21:00:54.607032,0 days 00:00:10.598289,advanced,0.49897050866854586,0.0011635711727477796,5,1,259,4.850248734594017,0.1059315608878958,0.785609900030437,advanced,COMPLETE
11,-0.000900831189491802,2025-12-04 21:00:54.609035,2025-12-04 21:02:40.426293,0 days 00:01:45.817258,advanced,0.8571863722591776,0.0022435556749506487,6,9,3789,1.646137183053573,19.0490095691167,0.7024891192679494,advanced,COMPLETE
12,-0.0006988037301836799,2025-12-04 21:02:40.427292,2025-12-04 21:04:45.583642,0 days 00:02:05.156350,advanced,0.738279760856559,0.002702711334398091,6,8,3940,1.4957701167097994,19.01069398066308,0.7137219606723852,advanced,COMPLETE
13,-0.0008003481277715588,2025-12-04 21:04:45.584649,2025-12-04 21:06:13.045575,0 days 00:01:27.460926,advanced,0.8763653277986873,0.002482262510578762,6,8,3987,1.5501861355280075,19.509515370514656,0.7385467813820495,advanced,COMPLETE
14,-0.000585045238705062,2025-12-04 21:06:13.048079,2025-12-04 21:07:26.180754,0 days 00:01:13.132675,advanced,0.7666269621041645,0.012776641845339002,6,19,3935,1.6042508930990853,11.349252347080414,0.8976101936167281,advanced,COMPLETE
15,-0.0004916219069970676,2025-12-04 21:07:26.181753,2025-12-04 21:08:29.064110,0 days 00:01:02.882357,extensive,0.7563930858845699,0.012757643268205355,3,20,3354,1.6823239270484815,9.223467845480242,0.8625366956196132,extensive,COMPLETE
16,-0.0009554738296852309,2025-12-04 21:08:29.065112,2025-12-04 21:09:27.733693,0 days 00:00:58.668581,extensive,0.7582484369489115,0.01394627068181505,3,20,3369,2.1095837399361974,7.830490671841776,0.8919903310086156,extensive,COMPLETE
17,-0.021227361973338077,2025-12-04 21:09:27.735694,2025-12-04 21:10:43.381621,0 days 00:01:15.645927,extensive,0.6940748061670389,0.049179400357851906,4,20,3293,0.9665990302988234,1.5008659858880098,0.8887857396746273,extensive,COMPLETE
18,-0.0009485252281791942,2025-12-04 21:10:43.383622,2025-12-04 21:11:57.020154,0 days 00:01:13.636532,extensive,0.8102249643049242,0.01301963461244502,4,17,3560,2.224285445014594,7.533882177935847,0.7948958444006318,extensive,COMPLETE
19,-0.0009470627425554786,2025-12-04 21:11:57.021661,2025-12-04 21:12:54.057571,0 days 00:00:57.035910,extensive,0.8168910833870044,0.012711233837902456,8,18,2879,3.6387196729957054,2.2964935493537384,0.3259205097245888,extensive,COMPLETE
20,-0.0015039006419018304,2025-12-04 21:12:54.058575,2025-12-04 21:13:26.421610,0 days 00:00:32.363035,extensive,0.6976875999436419,0.009841603968239836,3,14,727,1.0276277126186897,9.836729247647426,0.8172821029127815,extensive,COMPLETE
21,-0.0005184704050924527,2025-12-04 21:13:26.422611,2025-12-04 21:14:56.346245,0 days 00:01:29.923634,advanced,0.7524752099547356,0.00864444549925533,6,19,3973,1.5614227212190754,13.143648060015119,0.7537479421892035,advanced,COMPLETE
22,-0.0010774224549646345,2025-12-04 21:14:56.347245,2025-12-04 21:16:08.463819,0 days 00:01:12.116574,advanced,0.7967136746238545,0.009360334416887987,7,18,3469,1.9773669321759102,11.342594958781575,0.852344196351952,advanced,COMPLETE
23,-0.0019483053324929056,2025-12-04 21:16:08.465323,2025-12-04 21:17:09.790040,0 days 00:01:01.324717,medium,0.6957669640557046,0.016309888827655907,5,20,3597,1.2175500580059708,6.584354759894191,0.8995760862502634,medium,COMPLETE
24,-0.0009470627425554786,2025-12-04 21:17:09.790753,2025-12-04 21:18:06.379582,0 days 00:00:56.588829,advanced,0.6031255129887421,0.007847823885368787,8,14,3105,2.5969953580913456,3.178299623499619,0.7761372691781433,advanced,COMPLETE
25,-0.0008862801666697321,2025-12-04 21:18:06.380097,2025-12-04 21:19:30.136688,0 days 00:01:23.756591,extensive,0.6512393680781917,0.005547230628959956,6,18,3963,1.763674178518645,12.017147636222212,0.6581080613559308,extensive,COMPLETE
26,-0.000991278069671549,2025-12-04 21:19:30.138208,2025-12-04 21:20:40.066386,0 days 00:01:09.928178,advanced,0.7360740947932263,0.03625367145034972,4,19,3650,2.2290256914475615,0.9500859067560814,0.831366985854928,advanced,COMPLETE
27,-0.003956088832073694,2025-12-04 21:20:40.067892,2025-12-04 21:22:05.968926,0 days 00:01:25.901034,advanced,0.8335069501753098,0.017856731705023346,7,16,3197,1.2731195405452498,15.402704125401575,0.7515818604626588,advanced,COMPLETE
28,-0.024155502577960137,2025-12-04 21:22:05.970926,2025-12-04 21:23:22.702096,0 days 00:01:16.731170,medium,0.5394149190533061,0.011181265811498963,5,14,2740,0.7462162750352495,6.3151868899959505,0.8563315013576789,medium,COMPLETE
29,-0.0009650073081608479,2025-12-04 21:23:22.703097,2025-12-04 21:24:19.656665,0 days 00:00:56.953568,extensive,0.7833427443874608,0.00365848568431283,10,17,2414,1.8872731611968752,3.4538726224771716,0.8066042419948417,extensive,COMPLETE
30,-0.0009470627425554786,2025-12-04 21:24:19.658666,2025-12-04 21:24:55.342487,0 days 00:00:35.683821,advanced,0.6594080935262543,0.007455004255058162,6,19,1833,2.360876983984982,1.8385065277410564,0.6719099377120754,advanced,COMPLETE
31,-0.0004916151317659138,2025-12-04 21:24:55.343990,2025-12-04 21:26:42.897994,0 days 00:01:47.554004,advanced,0.7290836888448678,0.003917585023002092,6,7,3995,1.389480559571393,14.314897971078796,0.747053838068998,advanced,COMPLETE
32,-0.0011194038567460634,2025-12-04 21:26:42.900504,2025-12-04 21:28:33.125088,0 days 00:01:50.224584,advanced,0.737060356226175,0.0040885714621578285,7,5,3740,1.3428059303987965,12.021596534155167,0.7549527002195807,advanced,COMPLETE
33,-0.0277824701590057,2025-12-04 21:28:33.126595,2025-12-04 21:32:42.761529,0 days 00:04:09.634934,advanced,0.7092179439548278,0.005871576376792625,6,6,3420,0.644624780651041,8.404855799101908,0.5531041689717652,advanced,COMPLETE
34,-0.02317813418326768,2025-12-04 21:32:42.763518,2025-12-04 21:35:59.302253,0 days 00:03:16.538735,advanced,0.8433575416767418,0.008820012361503109,5,10,3965,0.8558059808550146,5.355198912262599,0.602525917861536,advanced,COMPLETE
35,-0.0010019748196467375,2025-12-04 21:35:59.303251,2025-12-04 21:37:24.596774,0 days 00:01:25.293523,advanced,0.6411751582484176,0.0017457808048577095,7,12,3737,1.7880481709783045,14.520974048382895,0.8656063914879104,advanced,COMPLETE
36,-0.001656152320934634,2025-12-04 21:37:24.599440,2025-12-04 21:38:47.372472,0 days 00:01:22.773032,medium,0.8925873599114315,0.004522710130066737,4,3,3500,1.1562148812818136,14.495537486741336,0.8185578002178922,medium,COMPLETE
37,-0.0009470627425554786,2025-12-04 21:38:47.374153,2025-12-04 21:39:44.333850,0 days 00:00:56.959697,advanced,0.5726865538373536,0.01637013112651553,8,15,2681,2.888717419789387,3.457288569060832,0.6926943840858089,advanced,COMPLETE
38,-0.0005105778675063751,2025-12-04 21:39:44.334869,2025-12-04 21:40:24.257009,0 days 00:00:39.922140,extensive,0.7701190876882721,0.00648946729929852,9,19,1043,1.4719497026410187,9.234374345001081,0.7667856467909088,extensive,COMPLETE
39,-0.011157849542141607,2025-12-04 21:40:24.258014,2025-12-04 21:42:37.841164,0 days 00:02:13.583150,extensive,0.6700884224728136,0.006405306213343755,9,5,745,0.4951547187039298,0.18224780682598768,0.7355648562927571,extensive,COMPLETE
40,-0.013822065359110866,2025-12-04 21:42:37.842670,2025-12-04 21:45:32.125905,0 days 00:02:54.283235,extensive,0.6268262634086222,0.002965481573343496,9,17,1120,0.12408157095577588,5.437850348794593,0.6397684261556966,extensive,COMPLETE
41,-0.0002505616757061402,2025-12-04 21:45:32.127905,2025-12-04 21:46:14.906586,0 days 00:00:42.778681,extensive,0.7491465543952058,0.010622214508162899,10,19,1971,1.469084059507108,8.985351190423495,0.7850667962683822,extensive,COMPLETE
42,-0.00015539469725104707,2025-12-04 21:46:14.907586,2025-12-04 21:46:43.810749,0 days 00:00:28.903163,extensive,0.7873665403462494,0.009991664995260848,10,19,1115,1.396337387406754,8.809027776001075,0.7689051860317547,extensive,COMPLETE
43,-0.0012528405072632272,2025-12-04 21:46:43.812253,2025-12-04 21:47:11.689147,0 days 00:00:27.876894,extensive,0.7212101797056043,0.02129468120325739,10,20,1061,1.3219312715209914,9.412204255702214,0.7845108643035373,extensive,COMPLETE
44,-0.0009307507855488654,2025-12-04 21:47:11.690651,2025-12-04 21:47:46.645164,0 days 00:00:34.954513,extensive,0.7965046620399795,0.010410536871023954,9,18,1981,1.927304726587999,3.9130756431831073,0.5634302886824186,extensive,COMPLETE
45,-0.0009470627425554786,2025-12-04 21:47:46.646168,2025-12-04 21:48:18.856334,0 days 00:00:32.210166,extensive,0.8621981779972799,0.006237301733646894,10,16,1674,2.4429499138304753,0.708111283261187,0.7151518886699508,extensive,COMPLETE
46,-0.0003330373307352345,2025-12-04 21:48:18.858008,2025-12-04 21:48:40.188834,0 days 00:00:21.330826,extensive,0.7815934703029643,0.004516470338776829,10,10,239,0.9762162257203592,6.3605494456466305,0.7814193263701122,extensive,COMPLETE
47,-0.0001874094333242556,2025-12-04 21:48:40.189834,2025-12-04 21:49:08.810775,0 days 00:00:28.620941,extensive,0.38287392054459174,0.0018776575170946623,10,10,539,1.0244332803476726,6.309819444901805,0.8284331438064274,extensive,COMPLETE
48,0.00010741610827635917,2025-12-04 21:49:08.811777,2025-12-04 21:49:35.537257,0 days 00:00:26.725480,extensive,0.30772985787886054,0.0015944633829823559,10,10,330,0.5653141462664635,2.7511313122378387,0.7291618755219131,extensive,COMPLETE
49,-0.00037925605824584707,2025-12-04 21:49:35.538761,2025-12-04 21:50:02.844694,0 days 00:00:27.305933,extensive,0.40942527145520347,0.0014159252289785297,10,11,203,0.36291770051108174,2.651888159387086,0.6878415848745272,extensive,COMPLETE
50,4.305614389758331e-05,2025-12-04 21:50:02.846196,2025-12-04 21:50:36.273435,0 days 00:00:33.427239,extensive,0.3615604310850698,0.0020785587705261593,10,10,407,0.6259597935770496,4.511293622584965,0.8001946590403743,extensive,COMPLETE
51,-0.00010235887557648778,2025-12-04 21:50:36.274436,2025-12-04 21:51:23.680311,0 days 00:00:47.405875,extensive,0.36177355283500107,0.0020211939819807095,10,10,497,0.49137330134244916,4.824192354212384,0.7984947965363687,extensive,COMPLETE
52,9.57726161073813e-05,2025-12-04 21:51:23.681816,2025-12-04 21:52:09.624953,0 days 00:00:45.943137,extensive,0.35445308455711344,0.0021624400885364454,10,9,498,0.5053636400738376,4.02492257070373,0.824139605163984,extensive,COMPLETE
53,0.00026836160722243374,2025-12-04 21:52:09.625413,2025-12-04 21:52:47.662185,0 days 00:00:38.036772,extensive,0.3652889520069668,0.002003037319184333,10,9,437,0.5635028367427792,4.387770789027782,0.8118822733553704,extensive,COMPLETE
54,-0.000737114520800645,2025-12-04 21:52:47.663781,2025-12-04 21:53:28.591329,0 days 00:00:40.927548,extensive,0.3036155251835401,0.0010702405097148182,9,9,468,0.013471494692259722,4.415076686161777,0.72393222427646,extensive,COMPLETE
55,-3.764626429884436e-05,2025-12-04 21:53:28.592330,2025-12-04 21:54:05.887599,0 days 00:00:37.295269,extensive,0.35823000948918804,0.002022130996137733,10,12,438,0.5707543271175466,2.3083715645683145,0.8001823113239774,extensive,COMPLETE
56,0.00012146918377068754,2025-12-04 21:54:05.889113,2025-12-04 21:54:42.053661,0 days 00:00:36.164548,extensive,0.36517950395108406,0.0020859902381274364,10,12,443,0.6068268781001992,2.0883397805387562,0.804093108684072,extensive,COMPLETE
57,-0.0009899494199158514,2025-12-04 21:54:42.056173,2025-12-04 21:56:36.122618,0 days 00:01:54.066445,extensive,0.42322523870170964,0.0014975951230506849,9,12,789,0.20601303439256125,2.0947923797744985,0.8756094429929033,extensive,COMPLETE
58,0.00014622170815100274,2025-12-04 21:56:36.124125,2025-12-04 21:57:04.829445,0 days 00:00:28.705320,extensive,0.3326633110987589,0.0013092408452031006,9,12,389,0.6542174271123183,1.5787360330045686,0.8446777756983938,extensive,COMPLETE
59,5.631035011995541e-05,2025-12-04 21:57:04.830949,2025-12-04 21:57:56.096422,0 days 00:00:51.265473,extensive,0.3201170084492222,0.0012653600499725843,9,9,908,0.7532354599072477,1.2502485098453748,0.833024662018064,extensive,COMPLETE
60,-0.00040986287376224934,2025-12-04 21:57:56.098426,2025-12-04 21:58:32.358601,0 days 00:00:36.260175,extensive,0.32300621970590726,0.001291100878489556,8,8,894,0.7976070157077759,1.159344524247269,0.4651518809276669,extensive,COMPLETE
61,-0.0005378709332815775,2025-12-04 21:58:32.359601,2025-12-04 21:59:19.589745,0 days 00:00:47.230144,extensive,0.3385537880207284,0.0022897518964884486,9,9,408,0.32031939651496444,1.506798858752914,0.8417751128177894,extensive,COMPLETE
62,0.0003178698848971632,2025-12-04 21:59:19.591133,2025-12-04 22:00:40.203960,0 days 00:01:20.612827,extensive,0.3905558340653929,0.0010016483104445999,9,13,613,0.22296932208448578,2.8846710544616174,0.829798588417914,extensive,COMPLETE
63,4.263152904585935e-05,2025-12-04 22:00:40.204462,2025-12-04 22:01:59.191050,0 days 00:01:18.986588,extensive,0.3902636476097762,0.0011940921960442259,9,13,616,0.24661176087000375,1.73858874059552,0.8379451957591371,extensive,COMPLETE
64,-0.00013936701229292728,2025-12-04 22:01:59.193140,2025-12-04 22:03:07.728724,0 days 00:01:08.535584,extensive,0.46403401638076924,0.001025126820032907,9,13,651,0.438685168325542,2.820173596699317,0.8768607590161832,extensive,COMPLETE
65,-0.00019906432402239105,2025-12-04 22:03:07.730725,2025-12-04 22:03:26.254199,0 days 00:00:18.523474,extensive,0.3205102983223448,0.0015997518536881791,8,11,330,0.8392715419084784,1.165930055135997,0.8540135311990498,extensive,COMPLETE
66,-0.02179403619512943,2025-12-04 22:03:26.255701,2025-12-04 22:04:31.992103,0 days 00:01:05.736402,medium,0.4326881261387651,0.00270645805260388,9,9,893,0.03288374851405698,0.839996079278312,0.8228267618024576,medium,COMPLETE
67,-0.0009470627425554786,2025-12-04 22:04:31.993103,2025-12-04 22:04:55.724074,0 days 00:00:23.730971,extensive,0.3003259254325688,0.0013399552347005486,10,7,1328,3.9382938670081167,0.634471469686239,0.8788845334052402,extensive,COMPLETE
68,0.00020688139622319449,2025-12-04 22:04:55.725582,2025-12-04 22:05:21.044657,0 days 00:00:25.319075,extensive,0.38623495141131786,0.0017153931872716229,9,8,324,0.6876176907459584,1.8445551447575455,0.8105586627810583,extensive,COMPLETE
69,-0.0010873255117281506,2025-12-04 22:05:21.046161,2025-12-04 22:06:47.603228,0 days 00:01:26.557067,extensive,0.3880176802816082,0.0017218767235964731,10,8,594,0.2515491812333182,1.8058913398261496,0.8121060324067542,extensive,COMPLETE
70,-0.00024894054197458865,2025-12-04 22:06:47.604776,2025-12-04 22:07:06.660281,0 days 00:00:19.055505,extensive,0.49019274538644864,0.003129501594823164,9,13,348,1.070153820225392,3.017178522508933,0.8528513375393306,extensive,COMPLETE
71,-0.00015460916853208642,2025-12-04 22:07:06.661281,2025-12-04 22:07:27.631064,0 days 00:00:20.969783,extensive,0.34902539249542924,0.0011809047146959454,9,9,301,0.724982963167984,1.1744780254572889,0.8374576220247284,extensive,COMPLETE
72,-0.00028432843941650354,2025-12-04 22:07:27.632063,2025-12-04 22:08:20.658897,0 days 00:00:53.026834,extensive,0.3802978656864125,0.0015313134600708988,8,12,842,0.5873723233373799,2.19757655741106,0.8152432088464308,extensive,COMPLETE
73,-0.0020240800713985005,2025-12-04 22:08:20.658897,2025-12-04 22:09:25.703074,0 days 00:01:05.044177,extensive,0.32817869231280716,0.002598543479340882,10,7,648,0.3991428954039593,1.3255037757942079,0.8691030654559544,extensive,COMPLETE
74,-0.0002997843210540048,2025-12-04 22:09:25.703577,2025-12-04 22:09:51.665573,0 days 00:00:25.961996,medium,0.404905772399211,0.0017958966026995014,9,6,964,0.9261630573036201,3.7889101421101543,0.7572852952323187,medium,COMPLETE
75,9.36523358973466e-05,2025-12-04 22:09:51.667076,2025-12-04 22:10:38.851503,0 days 00:00:47.184427,extensive,0.37077194326489055,0.001010330612558336,10,11,724,0.6920145691789874,2.4650066073985055,0.7323695641370362,extensive,COMPLETE
76,-0.00043919351318381467,2025-12-04 22:10:38.852503,2025-12-04 22:11:06.255853,0 days 00:00:27.403350,extensive,0.3734197372690068,0.0022328713817684987,10,11,713,1.1374452672262574,2.516447579412142,0.7314226381594474,extensive,COMPLETE
77,-0.00021227024560662353,2025-12-04 22:11:06.257363,2025-12-04 22:11:56.609492,0 days 00:00:50.352129,extensive,0.3401850455415764,0.001000607120779251,10,11,515,0.14910001500215708,1.5203212861389117,0.32077894009365693,extensive,COMPLETE
78,-0.00015235369746554225,2025-12-04 22:11:56.609994,2025-12-04 22:12:25.306559,0 days 00:00:28.696565,extensive,0.4464286927960508,0.0011377165143214272,10,15,291,0.5105993081235615,3.319863033347106,0.7708374761114856,extensive,COMPLETE
79,2.9776180616170045e-05,2025-12-04 22:12:25.309065,2025-12-04 22:13:01.885202,0 days 00:00:36.576137,extensive,0.40814704173372546,0.0013546624488743654,10,12,540,0.6662516812195011,2.0466250565842374,0.6217229505593332,extensive,COMPLETE
80,-0.0009470627425554786,2025-12-04 22:13:01.886202,2025-12-04 22:13:09.053546,0 days 00:00:07.167344,extensive,0.3494947165670902,0.0016377624307809399,10,13,204,3.3716784608544472,2.688096378198187,0.6665750761142165,extensive,COMPLETE
81,1.586341577486383e-05,2025-12-04 22:13:09.055546,2025-12-04 22:13:31.572825,0 days 00:00:22.517279,extensive,0.3113582400988481,0.0012906745876368213,9,9,390,0.7850324794462987,1.7991503582316022,0.8280143152321953,extensive,COMPLETE
82,-0.0007217485574325296,2025-12-04 22:13:31.574829,2025-12-04 22:14:52.430353,0 days 00:01:20.855524,extensive,0.36964035773636694,0.0014455563365721414,9,8,734,0.3333586801745438,1.3374896398242042,0.8999001774678975,extensive,COMPLETE
83,-0.00012207696560088502,2025-12-04 22:14:52.431354,2025-12-04 22:15:22.996444,0 days 00:00:30.565090,extensive,0.3957995182504855,0.0010898319957975944,9,10,597,0.8918248662422672,3.7722220760282483,0.7899080339055772,extensive,COMPLETE
84,2.334829940586758e-05,2025-12-04 22:15:22.997444,2025-12-04 22:16:14.887036,0 days 00:00:51.889592,extensive,0.3329089617133659,0.0012461996021421163,8,11,958,0.6827754051554231,2.3992187937083855,0.8438231645359204,extensive,COMPLETE
85,5.638967503185377e-05,2025-12-04 22:16:14.888598,2025-12-04 22:16:47.685299,0 days 00:00:32.796701,extensive,0.4257723068618695,0.001926931471319562,10,9,326,0.5049563942607809,3.1210823864350985,0.8086590688336687,extensive,COMPLETE
86,0.0006192986015039296,2025-12-04 22:16:47.686299,2025-12-04 22:17:04.737497,0 days 00:00:17.051198,medium,0.3504104222813695,0.0018999980337871707,10,14,318,0.46399563148869005,3.0485327949884766,0.8094184972209907,medium,COMPLETE
87,-0.0074167416794945025,2025-12-04 22:17:04.739497,2025-12-04 22:18:31.171524,0 days 00:01:26.432027,medium,0.3510506226930919,0.0022568522614906804,10,14,1212,0.17587457799322748,5.479960037274217,0.7612352610678468,medium,COMPLETE
88,-0.0002779053436537948,2025-12-04 22:18:31.172524,2025-12-04 22:18:59.426055,0 days 00:00:28.253531,medium,0.37661549927583,0.0028971257257339447,10,15,478,0.3577468612651314,1.6676553405940127,0.7415207759239206,medium,COMPLETE
89,0.00013480683978076927,2025-12-04 22:18:59.427055,2025-12-04 22:19:26.725497,0 days 00:00:27.298442,medium,0.34006101462672567,0.001713915567443763,10,14,677,0.5789091559616757,2.0328814870699556,0.7000617752170174,medium,COMPLETE
